{
  "schema_version": 1,
  "contract_version": "0.1.0",
  "source_issue": "PenniLogic/docs#78",
  "plan_id": "T-DSY-02",
  "registry_ref": {
    "commit": "1722fc79ab2abee15d3adc2ed2f3baaad4bd6ed4",
    "path": "planning/source/evidence/experience-coverage.json",
    "sha256": "sha256:2f7b27c1f6683d4c256a938ccfb0fc06614f83fe57996a4d7aeaf0b7cae0bf3a"
  },
  "direction_ref": null,
  "access": {
    "public_links_enabled": false,
    "external_sharing_enabled": false,
    "asset_export_enabled": false,
    "offboarding_revokes": true
  },
  "libraries": [
    {
      "id": "LIB-FOUNDATION",
      "kind": "foundation",
      "figma_file": "02 - Foundations library",
      "figma_page": "Foundations",
      "owner_role": "systems",
      "publish_roles": [
        "systems"
      ],
      "consumes": [],
      "status": "shell"
    },
    {
      "id": "LIB-COMPONENTS",
      "kind": "shared_semantic",
      "figma_file": "03 - Components library",
      "figma_page": "Components",
      "owner_role": "systems",
      "publish_roles": [
        "systems"
      ],
      "consumes": [
        "LIB-FOUNDATION"
      ],
      "status": "shell"
    },
    {
      "id": "LIB-ANDROID",
      "kind": "platform_variant",
      "figma_file": "03 - Components library",
      "figma_page": "Android variants",
      "owner_role": "systems",
      "publish_roles": [
        "systems"
      ],
      "consumes": [
        "LIB-FOUNDATION",
        "LIB-COMPONENTS"
      ],
      "status": "shell"
    },
    {
      "id": "LIB-WEB",
      "kind": "platform_variant",
      "figma_file": "03 - Components library",
      "figma_page": "Web variants",
      "owner_role": "systems",
      "publish_roles": [
        "systems"
      ],
      "consumes": [
        "LIB-FOUNDATION",
        "LIB-COMPONENTS"
      ],
      "status": "shell"
    },
    {
      "id": "LIB-ADMIN",
      "kind": "platform_variant",
      "figma_file": "03 - Components library",
      "figma_page": "Admin variants",
      "owner_role": "systems",
      "publish_roles": [
        "systems"
      ],
      "consumes": [
        "LIB-FOUNDATION",
        "LIB-COMPONENTS"
      ],
      "status": "shell"
    },
    {
      "id": "LIB-CANDIDATE",
      "kind": "candidate",
      "figma_file": null,
      "figma_page": null,
      "owner_role": "systems",
      "publish_roles": [],
      "consumes": [
        "LIB-FOUNDATION",
        "LIB-COMPONENTS"
      ],
      "status": "shell"
    }
  ],
  "releases": [
    {
      "library": "LIB-FOUNDATION",
      "version": "1.0.0",
      "previous": null,
      "change_class": "major",
      "breaking": false,
      "status": "draft",
      "migration_plan_ref": null,
      "cdo_approval": {
        "role": "decision_coordinator",
        "scope": "shared_system_major",
        "status": "pending",
        "decision_source": null
      },
      "rollback_to": null
    },
    {
      "library": "LIB-COMPONENTS",
      "version": "1.0.0",
      "previous": null,
      "change_class": "major",
      "breaking": false,
      "status": "draft",
      "migration_plan_ref": null,
      "cdo_approval": {
        "role": "decision_coordinator",
        "scope": "shared_system_major",
        "status": "pending",
        "decision_source": null
      },
      "rollback_to": null
    },
    {
      "library": "LIB-ANDROID",
      "version": "1.0.0",
      "previous": null,
      "change_class": "major",
      "breaking": false,
      "status": "draft",
      "migration_plan_ref": null,
      "cdo_approval": {
        "role": "decision_coordinator",
        "scope": "shared_system_major",
        "status": "pending",
        "decision_source": null
      },
      "rollback_to": null
    },
    {
      "library": "LIB-WEB",
      "version": "1.0.0",
      "previous": null,
      "change_class": "major",
      "breaking": false,
      "status": "draft",
      "migration_plan_ref": null,
      "cdo_approval": {
        "role": "decision_coordinator",
        "scope": "shared_system_major",
        "status": "pending",
        "decision_source": null
      },
      "rollback_to": null
    },
    {
      "library": "LIB-ADMIN",
      "version": "1.0.0",
      "previous": null,
      "change_class": "major",
      "breaking": false,
      "status": "draft",
      "migration_plan_ref": null,
      "cdo_approval": {
        "role": "decision_coordinator",
        "scope": "shared_system_major",
        "status": "pending",
        "decision_source": null
      },
      "rollback_to": null
    }
  ],
  "components": [
    {
      "id": "C-ACTION",
      "name": "Primary secondary tonal text and icon actions",
      "library": "LIB-COMPONENTS",
      "status": "draft",
      "semantic_role": null,
      "owner_role": "systems",
      "description": null,
      "platforms": [
        "android",
        "web",
        "admin"
      ],
      "properties": [],
      "accessibility": null,
      "variant_of": null,
      "since_version": null,
      "deprecation": null,
      "proposal_branch": null,
      "token_refs": []
    },
    {
      "id": "C-ACTION-FAB",
      "name": "Contextual Android floating action button",
      "library": "LIB-COMPONENTS",
      "status": "draft",
      "semantic_role": null,
      "owner_role": "systems",
      "description": null,
      "platforms": [
        "android"
      ],
      "properties": [],
      "accessibility": null,
      "variant_of": null,
      "since_version": null,
      "deprecation": null,
      "proposal_branch": null,
      "token_refs": []
    },
    {
      "id": "C-ACTION-MENU",
      "name": "Menu context menu and command action",
      "library": "LIB-COMPONENTS",
      "status": "draft",
      "semantic_role": null,
      "owner_role": "systems",
      "description": null,
      "platforms": [
        "android",
        "web",
        "admin"
      ],
      "properties": [],
      "accessibility": null,
      "variant_of": null,
      "since_version": null,
      "deprecation": null,
      "proposal_branch": null,
      "token_refs": []
    },
    {
      "id": "C-AI-ANSWER",
      "name": "Model answer citation refusal and override",
      "library": "LIB-COMPONENTS",
      "status": "draft",
      "semantic_role": null,
      "owner_role": "systems",
      "description": null,
      "platforms": [
        "android",
        "web"
      ],
      "properties": [],
      "accessibility": null,
      "variant_of": null,
      "since_version": null,
      "deprecation": null,
      "proposal_branch": null,
      "token_refs": []
    },
    {
      "id": "C-BILLING-PLAN",
      "name": "Plan channel quota invoice and lifecycle",
      "library": "LIB-COMPONENTS",
      "status": "draft",
      "semantic_role": null,
      "owner_role": "systems",
      "description": null,
      "platforms": [
        "android",
        "web",
        "admin"
      ],
      "properties": [],
      "accessibility": null,
      "variant_of": null,
      "since_version": null,
      "deprecation": null,
      "proposal_branch": null,
      "token_refs": []
    },
    {
      "id": "C-DATA-AMOUNT",
      "name": "Currency amount balance and delta",
      "library": "LIB-COMPONENTS",
      "status": "draft",
      "semantic_role": null,
      "owner_role": "systems",
      "description": null,
      "platforms": [
        "android",
        "web",
        "admin"
      ],
      "properties": [],
      "accessibility": null,
      "variant_of": null,
      "since_version": null,
      "deprecation": null,
      "proposal_branch": null,
      "token_refs": []
    },
    {
      "id": "C-DATA-CHART",
      "name": "Accessible financial chart with table equivalent",
      "library": "LIB-COMPONENTS",
      "status": "draft",
      "semantic_role": null,
      "owner_role": "systems",
      "description": null,
      "platforms": [
        "android",
        "web",
        "admin"
      ],
      "properties": [],
      "accessibility": null,
      "variant_of": null,
      "since_version": null,
      "deprecation": null,
      "proposal_branch": null,
      "token_refs": []
    },
    {
      "id": "C-DATA-COMPARISON",
      "name": "Neutral strategy and scenario comparison",
      "library": "LIB-COMPONENTS",
      "status": "draft",
      "semantic_role": null,
      "owner_role": "systems",
      "description": null,
      "platforms": [
        "android",
        "web",
        "admin"
      ],
      "properties": [],
      "accessibility": null,
      "variant_of": null,
      "since_version": null,
      "deprecation": null,
      "proposal_branch": null,
      "token_refs": []
    },
    {
      "id": "C-DATA-DEBT",
      "name": "Debt summary schedule and status",
      "library": "LIB-COMPONENTS",
      "status": "draft",
      "semantic_role": null,
      "owner_role": "systems",
      "description": null,
      "platforms": [
        "android",
        "web",
        "admin"
      ],
      "properties": [],
      "accessibility": null,
      "variant_of": null,
      "since_version": null,
      "deprecation": null,
      "proposal_branch": null,
      "token_refs": []
    },
    {
      "id": "C-DATA-DERIVATION",
      "name": "Explain why this number derivation",
      "library": "LIB-COMPONENTS",
      "status": "draft",
      "semantic_role": null,
      "owner_role": "systems",
      "description": null,
      "platforms": [
        "android",
        "web",
        "admin"
      ],
      "properties": [],
      "accessibility": null,
      "variant_of": null,
      "since_version": null,
      "deprecation": null,
      "proposal_branch": null,
      "token_refs": []
    },
    {
      "id": "C-DATA-GOAL",
      "name": "Goal contribution and progress",
      "library": "LIB-COMPONENTS",
      "status": "draft",
      "semantic_role": null,
      "owner_role": "systems",
      "description": null,
      "platforms": [
        "android",
        "web",
        "admin"
      ],
      "properties": [],